<?xml version="1.0" encoding="UTF-8"?>
<roadDescription xmlns="http://opends.eu/roadDescription"
		xmlns:xsi="http://www.w3.org/2001/XMLSchema-instance" 
        xsi:schemaLocation="http://opends.eu/roadDescription roadDescription.xsd">

    <terrain>	
		<extent length="500" width="500" maxHeight="15" />		
		<heightMap path="Assets/test6.raw" resolution="2048"/>
		<roadStartingPoint x="100" z="100" />
    </terrain>
	
	     
    <segments>
    	<segment id="s000" initial="true">
    		<geometries>
    			<geometry length="50" curvature="0" />
				<geometry length="50" curvature="-60" />
			</geometries>
			<successor>
				<segment ref="s001" />
			</successor>
			<laneLayout>
				<noOfLanes>2</noOfLanes>
				<laneWidth>2.60</laneWidth>
				<speedLimit>80</speedLimit>
				<speedLimitOppositeDirection>80</speedLimitOppositeDirection>
			</laneLayout>
			<surface>
				<friction>1.2</friction>
			</surface>
    	</segment>
		
    	<segment id="s001" initial="false">
    		<geometries>
				<geometry length="50" curvature="0" />
				<geometry length="30" curvature="50" />
				<geometry length="50" curvature="0" />
			</geometries>
			<successor>
				<intersection ref="i001" />
			</successor>
			<laneLayout>
				<noOfLanes>2</noOfLanes>
				<laneWidth>2.60</laneWidth>
				<speedLimit>80</speedLimit>
				<speedLimitOppositeDirection>80</speedLimitOppositeDirection>
			</laneLayout>
			<surface>
				<friction>1.2</friction>
			</surface>
    	</segment>
    
		<segment id="s002" initial="false">
    		<geometries>
    			<geometry length="100" curvature="0" />
				<geometry length="100" curvature="90" />
			</geometries>
			<laneLayout>
				<noOfLanes>2</noOfLanes>
				<laneWidth>2.60</laneWidth>
				<speedLimit>80</speedLimit>
				<speedLimitOppositeDirection>80</speedLimitOppositeDirection>
			</laneLayout>
			<surface>
				<friction>1.2</friction>
			</surface>
    	</segment>
		
		<segment id="s003" initial="false">
    		<geometries>
    			<geometry length="100" curvature="0" />
				<geometry length="50" curvature="90" />
			</geometries>
			<successor>
				<intersection ref="i002" />
			</successor>
			<laneLayout>
				<noOfLanes>2</noOfLanes>
				<laneWidth>2.60</laneWidth>
				<speedLimit>80</speedLimit>
				<speedLimitOppositeDirection>80</speedLimitOppositeDirection>
			</laneLayout>
			<surface>
				<friction>1.2</friction>
			</surface>
    	</segment>
		
		<segment id="s004" initial="false">
    		<geometries>
    			<geometry length="100" curvature="0" />
				<geometry length="100" curvature="-90" />
				<geometry length="100" curvature="0" />
			</geometries>
			<laneLayout>
				<noOfLanes>2</noOfLanes>
				<laneWidth>2.60</laneWidth>
				<speedLimit>80</speedLimit>
				<speedLimitOppositeDirection>80</speedLimitOppositeDirection>
			</laneLayout>
			<surface>
				<friction>1.2</friction>
			</surface>
    	</segment>
				
		<segment id="s010" initial="false">
    		<geometries>
    			<geometry length="50" curvature="0" />
			</geometries>
			<laneLayout>
				<noOfLanes>2</noOfLanes>
				<laneWidth>2.60</laneWidth>
				<speedLimit>80</speedLimit>
				<speedLimitOppositeDirection>80</speedLimitOppositeDirection>
			</laneLayout>
			<surface>
				<friction>1.2</friction>
			</surface>
    	</segment> 
		
		<!--
		<segment id="s011" initial="false">
    		<geometries>
    			<geometry length="40" curvature="0" />
			</geometries>
			<laneLayout>
				<noOfLanes>2</noOfLanes>
				<laneWidth>2.60</laneWidth>
				<speedLimit>80</speedLimit>
				<speedLimitOppositeDirection>80</speedLimitOppositeDirection>
			</laneLayout>
			<surface>
				<friction>1.2</friction>
			</surface>
    	</segment> 
		-->
		
		<segment id="s012" initial="false">
    		<geometries>
    			<geometry length="30" curvature="0" />
			</geometries>
			<laneLayout>
				<noOfLanes>2</noOfLanes>
				<laneWidth>2.60</laneWidth>
				<speedLimit>80</speedLimit>
				<speedLimitOppositeDirection>80</speedLimitOppositeDirection>
			</laneLayout>
			<surface>
				<friction>1.2</friction>
			</surface>
    	</segment> 
    </segments>
    
    
	
    <intersections>
    	<intersection id="i001" type="crossing">
    		<outgoingSegment ref="s002" degree="-90"/>
			<outgoingSegment ref="s003" degree="0"/>
			<outgoingSegment ref="s004" degree="90" /> 
    	</intersection>
    	
    	 <intersection id="i002" type="crossing">
    		<outgoingSegment ref="s010" degree="-90" />
			<outgoingSegment ref="s012" degree="90" /> 
		</intersection>
    </intersections>
	
    
    <traffic>
		<codriver>
			<startPosition segment="s000" lane="-1" s="0" />
			<preferredConnections>
        		<connection intersectionID="i001" from="s000" to="s002" />
        	</preferredConnections>
        	<targetPosition segment="s004" lane="-1" s="22"/>
        	<terminateSimulation onTargetPositionReached="true" onRoadEndReached="true" />
		</codriver>
		<vehicles>
			<vehicle id="car01">
				<maxSpeed>50</maxSpeed>
				<startPosition segment="s002" lane="1" s="0" />
				<preferredConnections>
					<connection intersectionID="i001" from="s002" to="s003" />
				</preferredConnections>
			</vehicle>
		</vehicles>
		<pedestrians>
			<pedestrian id="pedestrian01" >
    			<startPosition segment="s000" lateralOffset="-5.3" s="0" />
    			<targets>
        		 	<target lateralOffset="-5.3" s="40" speed="4.1" />
        			<target lateralOffset="5.3" s="60" speed="2.8" />
        			<target lateralOffset="5.3" s="80" speed="4.3" />
    			</targets>
    			<triggerPosition segment="s001" lane="-1" s="10" />
			</pedestrian>
			<pedestrian id="pedestrian02" >
    			<startPosition segment="s001" lateralOffset="-5.3" s="0" />
    			<targets>
        			<target lateralOffset="-5.3" s="30" speed="4.1" />
        			<target lateralOffset="5.3" s="30" speed="2.8" />
        			<target lateralOffset="5.3" s="60" speed="4.3" />
        			<target lateralOffset="-5.3" s="60" speed="1.5" />
    			</targets>
    			<triggerPosition segment="s002" lane="-1" s="10" />
			</pedestrian>
		</pedestrians>
	</traffic>
	
</roadDescription>